<?xml version="1.0" encoding="UTF-8"?>
<tns:configurations
	xmlns:tns="http://httpconnector.coe.cordys.com/2.0/configuration"
	xmlns:xsi="http://www.w3.org/2001/XMLSchema-instance"
	xsi:schemaLocation="http://httpconnector.coe.cordys.com/2.0/configuration ../../../../../../../../docs/external/configuration.xsd ">
	<tns:connections>
		<tns:connection id="JIRA">
			<tns:url>http://cnl1259:8080</tns:url>
			<tns:parameters>
				<tns:parameter type="string">
					<tns:name>jira_username</tns:name>
					<tns:value>pgussow</tns:value>
				</tns:parameter>
				<tns:parameter type="encoded">
					<tns:name>jira_password</tns:name>
					<tns:value>cGd1c3Nvdw==</tns:value>
				</tns:parameter>
			</tns:parameters>
		</tns:connection>
	</tns:connections>
</tns:configurations>
