<?xml version="1.0" encoding="UTF-8"?>
<tns:configurations xmlns:tns="http://httpconnector.coe.cordys.com/2.0/configuration" xmlns:xsi="http://www.w3.org/2001/XMLSchema-instance" xsi:schemaLocation="http://httpconnector.coe.cordys.com/2.0/configuration configuration.xsd ">
  <tns:connections>
    <tns:connection id="">
      <tns:url>http://tempuri.org</tns:url>
      <tns:timeout>0</tns:timeout>
      <tns:username>tns:username</tns:username>
      <tns:password>tns:password</tns:password>
      <tns:proxy-host>tns:proxy-host</tns:proxy-host>
      <tns:proxy-port>0</tns:proxy-port>
      <tns:proxy-username>tns:proxy-username</tns:proxy-username>
      <tns:proxy-password>tns:proxy-password</tns:proxy-password>
      <tns:check-certificate>true</tns:check-certificate>
      <tns:authenticate-always>true</tns:authenticate-always>
      <tns:parameters>
        <tns:parameter type="string">
          <tns:name>tns:name</tns:name>
          <tns:value/>
        </tns:parameter>
      </tns:parameters>
    </tns:connection>
  </tns:connections>
</tns:configurations>
